"a-profile href","a-profile-avatar","a-profile-name","a-size-base href","a-icon-alt","a-size-base","a-size-base 2","a-size-mini","a-size-mini href","a-size-base 3","a-size-base 4","a-button-text href","a-size-base 5","a-size-base href 2","a-size-base 6","a-lazy-loaded src"
"https://www.amazon.com/gp/profile/amzn1.account.AFTNKNA55OZ6HCPBDXSELDBQYCNQ/ref=cm_cr_arp_d_gw_btm?ie=UTF8","<img src=""https://images-na.ssl-images-amazon.com/images/S/amazon-avatars-global/default._CR0,0,1024,1024_SX48_.png""/>","Alanamous","https://www.amazon.com/gp/customer-reviews/RBL72ICO6C8BS/ref=cm_cr_arp_d_rvw_ttl?ie=UTF8&ASIN=B00JN9EP6E","5.0 out of 5 stars","Perfect cover-up for the poop eating pup!","Reviewed in the United States on June 1, 2019","Flavor Name: Yogurt And BananaSize: 5.5 Ounce (Pack of 1)","https://www.amazon.com/Twistix-5-5-Ounce-Dental-Peanut-Flavor/product-reviews/B00HB9ME7A/ref=cm_cr_arp_d_rvw_fmt?ie=UTF8&formatType=current_format","My pup is one of those dogs who has the nasty habit of eating poop. If I don't monitor her then she will eat her own and  her sister's feces as well. Plus, both of my pups love to eat the cat and possum poop that gets burried under the mulch along the sidewalks late at night while the rest of the neighborhood sleeps soundly and unsuspectingly. My pups will yank me off course the second they smell the pungent poop de possum, burrying their noses in the dirt and slurping it up before I am able to react. DISGUSTING!!!!Lucky for me, awhile ago a friend accidentally had one of her orders from Chewy shipped to me. We got everything straightened out and sent her a new box, but I got to keep the box sent to me and I shared some of the goodies with a local rescue too. Anyways, among the goodies she had ordered were these Twistix Yogurt Chew Treats. She had ordered both the banana and mint flavors. I gave one to each of my sweet puppies, at a time when they were behaving, and I noticed how wonderful it made their breath smell. Surprisingly enough, my doggy doo doo eater normally has pretty good breath, however my other pup has pretty disgusting breath from licking her anal glands. Poop pup.Well, the next time Poopy Puppy managed to snag herself a disgusting snack I decided she needed to floss her teeth with a Twistix Yogurt and Banana Dental Chew treat. Boy am I glad I gave her one! It did the trick of cleaning out the nasty particles that I could see clinging to her back teeth when she had flashed me a big, toothy grin and I easily caught a waft of her sewage breath. But after the Twistix I wasn't as paranoid about her stealing one of my pillows off of the couch or doing something equally appalling.I know I chose to live with this disgusting monster, and I definitely love her. But I'm truly thankful to have discovered something that helps make the difficult parts much more bearable. Because it's no fun to think the best thing in your life is unbearable in the slightest.","7 people found this helpful","https://www.amazon.com/ap/signin?openid.return_to=https%3A%2F%2Fwww.amazon.com%2FTwistix-5-5-Ounce-Dental-Peanut-Flavor%2Fproduct-reviews%2FB00JN9EP6E%2Fref%3Dcm_cr_arp_d_vote_lft%3Fie%3DUTF8%26csrfT%3DhG%252FVVwtSWBPNv21y02%252FfUt4mVfwf29GZQiuyrpTlIlZDAAAAAGXT40EAAAAB%26reviewId%3DRBL72ICO6C8BS&openid.identity=http%3A%2F%2Fspecs.openid.net%2Fauth%2F2.0%2Fidentifier_select&openid.assoc_handle=usflex&openid.mode=checkid_setup&marketPlaceId=ATVPDKIKX0DER&language=en&openid.claimed_id=http%3A%2F%2Fspecs.openid.net%2Fauth%2F2.0%2Fidentifier_select&openid.ns=http%3A%2F%2Fspecs.openid.net%2Fauth%2F2.0","Report","https://www.amazon.com/hz/reviews-render/report-review?ie=UTF8&ref=cm_cr_arp_d_rvw_hlp&csrfT=hG%2FVVwtSWBPNv21y02%2FfUt4mVfwf29GZQiuyrpTlIlZDAAAAAGXT40EAAAAB&reviewId=RBL72ICO6C8BS","Showing  comments",""
"https://www.amazon.com/gp/profile/amzn1.account.AHC3GQU6KSZBMEDICBUHCRW643NQ/ref=cm_cr_arp_d_gw_btm?ie=UTF8","<img src=""https://images-na.ssl-images-amazon.com/images/S/amazon-avatars-global/default._CR0,0,1024,1024_SX48_.png""/>","Lynn Y.","https://www.amazon.com/gp/customer-reviews/R2OFPM8P5BHRPF/ref=cm_cr_arp_d_rvw_ttl?ie=UTF8&ASIN=B00JN9EP6E","5.0 out of 5 stars","Dog Loves These","Reviewed in the United States on February 2, 2024","Flavor Name: Vanilla MintSize: Small (Pack of 1)","https://www.amazon.com/Twistix-5-5-Ounce-Dental-Peanut-Flavor/product-reviews/B00GTV7WA0/ref=cm_cr_arp_d_rvw_fmt?ie=UTF8&formatType=current_format","My dog thinks this is a treat and she is very fussy.","Report","https://www.amazon.com/ap/signin?openid.return_to=https%3A%2F%2Fwww.amazon.com%2FTwistix-5-5-Ounce-Dental-Peanut-Flavor%2Fproduct-reviews%2FB00JN9EP6E%2Fref%3Dcm_cr_arp_d_vote_lft%3Fie%3DUTF8%26csrfT%3DhGA7n%252BJMU1oEGi9i1fviLKEJmCmkLnMg6VIPfXvPe698AAAAAGXT40EAAAAB%26reviewId%3DR2OFPM8P5BHRPF&openid.identity=http%3A%2F%2Fspecs.openid.net%2Fauth%2F2.0%2Fidentifier_select&openid.assoc_handle=usflex&openid.mode=checkid_setup&marketPlaceId=ATVPDKIKX0DER&language=en&openid.claimed_id=http%3A%2F%2Fspecs.openid.net%2Fauth%2F2.0%2Fidentifier_select&openid.ns=http%3A%2F%2Fspecs.openid.net%2Fauth%2F2.0","Showing  comments","https://www.amazon.com/hz/reviews-render/report-review?ie=UTF8&ref=cm_cr_arp_d_rvw_hlp&csrfT=hGA7n%2BJMU1oEGi9i1fviLKEJmCmkLnMg6VIPfXvPe698AAAAAGXT40EAAAAB&reviewId=R2OFPM8P5BHRPF","","https://images-na.ssl-images-amazon.com/images/G/01/x-locale/common/grey-pixel.gif"
"https://www.amazon.com/gp/profile/amzn1.account.AFIWR7XHEALT2RFIC6QLKM6RHU4A/ref=cm_cr_arp_d_gw_btm?ie=UTF8","<img src=""https://images-na.ssl-images-amazon.com/images/S/amazon-avatars-global/default._CR0,0,1024,1024_SX48_.png""/>","Lola's Mommy","https://www.amazon.com/gp/customer-reviews/R2KC5XPOB6I8B8/ref=cm_cr_arp_d_rvw_ttl?ie=UTF8&ASIN=B00JN9EP6E","4.0 out of 5 stars","Excellent product but WAY overpriced for some reason","Reviewed in the United States on April 19, 2018","Flavor Name: Vanilla MintSize: Small (Pack of 1)","https://www.amazon.com/Twistix-5-5-Ounce-Dental-Peanut-Flavor/product-reviews/B00GTV7WA0/ref=cm_cr_arp_d_rvw_fmt?ie=UTF8&formatType=current_format","I took a star off because for some reason the price recently jumped from $4 to $12. Last time this happened was because of repackaging so fingers crossed it goes back down again soon. That said, my dog absolutely loves these and has been eating one of these a day since she was a puppy. She has a severe underbite and her bottom teeth stick out no matter what, but our vet is always shocked those teeth are in perfect condition. As a puppy they told us we might have to remove those teeth in a year or two because they’re constantly out and would rot, but we’re almost to 9 years & the vet said to keep doing what we’re doing because those teeth are in great condition!","3 people found this helpful","https://www.amazon.com/ap/signin?openid.return_to=https%3A%2F%2Fwww.amazon.com%2FTwistix-5-5-Ounce-Dental-Peanut-Flavor%2Fproduct-reviews%2FB00JN9EP6E%2Fref%3Dcm_cr_arp_d_vote_lft%3Fie%3DUTF8%26csrfT%3DhJVqCt6ghupkMVzdtWvjTve5FlQWQbZSqzLrxzxYbizRAAAAAGXT40EAAAAB%26reviewId%3DR2KC5XPOB6I8B8&openid.identity=http%3A%2F%2Fspecs.openid.net%2Fauth%2F2.0%2Fidentifier_select&openid.assoc_handle=usflex&openid.mode=checkid_setup&marketPlaceId=ATVPDKIKX0DER&language=en&openid.claimed_id=http%3A%2F%2Fspecs.openid.net%2Fauth%2F2.0%2Fidentifier_select&openid.ns=http%3A%2F%2Fspecs.openid.net%2Fauth%2F2.0","Report","https://www.amazon.com/hz/reviews-render/report-review?ie=UTF8&ref=cm_cr_arp_d_rvw_hlp&csrfT=hJVqCt6ghupkMVzdtWvjTve5FlQWQbZSqzLrxzxYbizRAAAAAGXT40EAAAAB&reviewId=R2KC5XPOB6I8B8","Showing  comments","https://images-na.ssl-images-amazon.com/images/G/01/x-locale/common/grey-pixel.gif"
"https://www.amazon.com/gp/profile/amzn1.account.AHDSW5TPUFLVWMMNURMIKW5FX5EQ/ref=cm_cr_arp_d_gw_btm?ie=UTF8","<img src=""https://images-na.ssl-images-amazon.com/images/S/amazon-avatars-global/default._CR0,0,1024,1024_SX48_.png""/>","Karen Taylor","https://www.amazon.com/gp/customer-reviews/R1EMD97ILA8PRF/ref=cm_cr_arp_d_rvw_ttl?ie=UTF8&ASIN=B00JN9EP6E","5.0 out of 5 stars","No more poop breath!!!","Reviewed in the United States on March 10, 2023","Flavor Name: Vanilla MintSize: Small (Pack of 1)","https://www.amazon.com/Twistix-5-5-Ounce-Dental-Peanut-Flavor/product-reviews/B00GTV7WA0/ref=cm_cr_arp_d_rvw_fmt?ie=UTF8&formatType=current_format","My pup's breath smelled like poop, as if he ate some. I tried brushing and Dentastix but neither helped. After ne pack of these, his breath doesn't smell like poop anymore! I give him one after every meal, since certain foods will cause his breath to be extra stinky. Will definitely be buying more in the future.","Report","https://www.amazon.com/ap/signin?openid.return_to=https%3A%2F%2Fwww.amazon.com%2FTwistix-5-5-Ounce-Dental-Peanut-Flavor%2Fproduct-reviews%2FB00JN9EP6E%2Fref%3Dcm_cr_arp_d_vote_lft%3Fie%3DUTF8%26csrfT%3DhAnkhlX624SJZyXSr4kdBkz5q25gp%252BzPBX6InCtI9Ub%252FAAAAAGXT40EAAAAB%26reviewId%3DR1EMD97ILA8PRF&openid.identity=http%3A%2F%2Fspecs.openid.net%2Fauth%2F2.0%2Fidentifier_select&openid.assoc_handle=usflex&openid.mode=checkid_setup&marketPlaceId=ATVPDKIKX0DER&language=en&openid.claimed_id=http%3A%2F%2Fspecs.openid.net%2Fauth%2F2.0%2Fidentifier_select&openid.ns=http%3A%2F%2Fspecs.openid.net%2Fauth%2F2.0","Showing  comments","https://www.amazon.com/hz/reviews-render/report-review?ie=UTF8&ref=cm_cr_arp_d_rvw_hlp&csrfT=hAnkhlX624SJZyXSr4kdBkz5q25gp%2BzPBX6InCtI9Ub%2FAAAAAGXT40EAAAAB&reviewId=R1EMD97ILA8PRF","","https://images-na.ssl-images-amazon.com/images/G/01/x-locale/common/grey-pixel.gif"
"https://www.amazon.com/gp/profile/amzn1.account.AH3F5UWIBOMDINNTBK6Z37X3YENA/ref=cm_cr_arp_d_gw_btm?ie=UTF8","<img src=""https://images-na.ssl-images-amazon.com/images/S/amazon-avatars-global/default._CR0,0,1024,1024_SX48_.png""/>","Annessex Holland","https://www.amazon.com/gp/customer-reviews/RLV4TAF1VAFO8/ref=cm_cr_arp_d_rvw_ttl?ie=UTF8&ASIN=B00JN9EP6E","5.0 out of 5 stars","Yogurt dog treats","Reviewed in the United States on November 13, 2023","Flavor Name: Yogurt And BananaSize: 5.5 Ounce (Pack of 1)","https://www.amazon.com/Twistix-5-5-Ounce-Dental-Peanut-Flavor/product-reviews/B00HB9ME7A/ref=cm_cr_arp_d_rvw_fmt?ie=UTF8&formatType=current_format","My dog loves them","Report","https://www.amazon.com/ap/signin?openid.return_to=https%3A%2F%2Fwww.amazon.com%2FTwistix-5-5-Ounce-Dental-Peanut-Flavor%2Fproduct-reviews%2FB00JN9EP6E%2Fref%3Dcm_cr_arp_d_vote_lft%3Fie%3DUTF8%26csrfT%3DhCz8KTXCNC318KTlQqNgINaWBRSAvHGwQ2TexcC%252FFKrkAAAAAGXT40EAAAAB%26reviewId%3DRLV4TAF1VAFO8&openid.identity=http%3A%2F%2Fspecs.openid.net%2Fauth%2F2.0%2Fidentifier_select&openid.assoc_handle=usflex&openid.mode=checkid_setup&marketPlaceId=ATVPDKIKX0DER&language=en&openid.claimed_id=http%3A%2F%2Fspecs.openid.net%2Fauth%2F2.0%2Fidentifier_select&openid.ns=http%3A%2F%2Fspecs.openid.net%2Fauth%2F2.0","Showing  comments","https://www.amazon.com/hz/reviews-render/report-review?ie=UTF8&ref=cm_cr_arp_d_rvw_hlp&csrfT=hCz8KTXCNC318KTlQqNgINaWBRSAvHGwQ2TexcC%2FFKrkAAAAAGXT40EAAAAB&reviewId=RLV4TAF1VAFO8","","https://images-na.ssl-images-amazon.com/images/G/01/x-locale/common/grey-pixel.gif"
"https://www.amazon.com/gp/profile/amzn1.account.AGJLHO7UG7UATNLDVCGIUBQ6O64Q/ref=cm_cr_arp_d_gw_btm?ie=UTF8","<img src=""https://images-na.ssl-images-amazon.com/images/S/amazon-avatars-global/default._CR0,0,1024,1024_SX48_.png""/>","RobSha","https://www.amazon.com/gp/customer-reviews/R144L2AHMQPUIF/ref=cm_cr_arp_d_rvw_ttl?ie=UTF8&ASIN=B00JN9EP6E","5.0 out of 5 stars","Good for teeth","Reviewed in the United States on July 12, 2023","Flavor Name: Vanilla MintSize: Small (Pack of 1)","https://www.amazon.com/Twistix-5-5-Ounce-Dental-Peanut-Flavor/product-reviews/B00GTV7WA0/ref=cm_cr_arp_d_rvw_fmt?ie=UTF8&formatType=current_format","Our dogs love these and it takes a bit for them to finish...good product","Report","https://www.amazon.com/ap/signin?openid.return_to=https%3A%2F%2Fwww.amazon.com%2FTwistix-5-5-Ounce-Dental-Peanut-Flavor%2Fproduct-reviews%2FB00JN9EP6E%2Fref%3Dcm_cr_arp_d_vote_lft%3Fie%3DUTF8%26csrfT%3DhFOEfboPZyz%252FxVaeb8dT%252B1iR2z%252ByQVIo8yeTAKlmGx1kAAAAAGXT40EAAAAB%26reviewId%3DR144L2AHMQPUIF&openid.identity=http%3A%2F%2Fspecs.openid.net%2Fauth%2F2.0%2Fidentifier_select&openid.assoc_handle=usflex&openid.mode=checkid_setup&marketPlaceId=ATVPDKIKX0DER&language=en&openid.claimed_id=http%3A%2F%2Fspecs.openid.net%2Fauth%2F2.0%2Fidentifier_select&openid.ns=http%3A%2F%2Fspecs.openid.net%2Fauth%2F2.0","Showing  comments","https://www.amazon.com/hz/reviews-render/report-review?ie=UTF8&ref=cm_cr_arp_d_rvw_hlp&csrfT=hFOEfboPZyz%2FxVaeb8dT%2B1iR2z%2ByQVIo8yeTAKlmGx1kAAAAAGXT40EAAAAB&reviewId=R144L2AHMQPUIF","","https://images-na.ssl-images-amazon.com/images/G/01/x-locale/common/grey-pixel.gif"
"https://www.amazon.com/gp/profile/amzn1.account.AHO43SRU4SCSJL43GKBHSKBIHVJA/ref=cm_cr_arp_d_gw_btm?ie=UTF8","<img src=""https://images-na.ssl-images-amazon.com/images/S/amazon-avatars-global/default._CR0,0,1024,1024_SX48_.png""/>","Brandon Simmons","https://www.amazon.com/gp/customer-reviews/R3BIMWI1QZGNZ2/ref=cm_cr_arp_d_rvw_ttl?ie=UTF8&ASIN=B00JN9EP6E","3.0 out of 5 stars","Meh","Reviewed in the United States on April 12, 2023","Flavor Name: Vanilla MintSize: Small (Pack of 1)","https://www.amazon.com/Twistix-5-5-Ounce-Dental-Peanut-Flavor/product-reviews/B00GTV7WA0/ref=cm_cr_arp_d_rvw_fmt?ie=UTF8&formatType=current_format","My dogs will eat these but aren’t excited when I give them these. They love Minties way better!","Report","https://www.amazon.com/ap/signin?openid.return_to=https%3A%2F%2Fwww.amazon.com%2FTwistix-5-5-Ounce-Dental-Peanut-Flavor%2Fproduct-reviews%2FB00JN9EP6E%2Fref%3Dcm_cr_arp_d_vote_lft%3Fie%3DUTF8%26csrfT%3DhLc8xM0Sdlsc%252F41mFZzSqt8gtUT8RZR%252BBo9Fh8T6zLC2AAAAAGXT40EAAAAB%26reviewId%3DR3BIMWI1QZGNZ2&openid.identity=http%3A%2F%2Fspecs.openid.net%2Fauth%2F2.0%2Fidentifier_select&openid.assoc_handle=usflex&openid.mode=checkid_setup&marketPlaceId=ATVPDKIKX0DER&language=en&openid.claimed_id=http%3A%2F%2Fspecs.openid.net%2Fauth%2F2.0%2Fidentifier_select&openid.ns=http%3A%2F%2Fspecs.openid.net%2Fauth%2F2.0","Showing  comments","https://www.amazon.com/hz/reviews-render/report-review?ie=UTF8&ref=cm_cr_arp_d_rvw_hlp&csrfT=hLc8xM0Sdlsc%2F41mFZzSqt8gtUT8RZR%2BBo9Fh8T6zLC2AAAAAGXT40EAAAAB&reviewId=R3BIMWI1QZGNZ2","","https://images-na.ssl-images-amazon.com/images/G/01/x-locale/common/grey-pixel.gif"
"https://www.amazon.com/gp/profile/amzn1.account.AGIRYTZHAIZEGS3QQHY53FDR7VDQ/ref=cm_cr_arp_d_gw_btm?ie=UTF8","<img src=""https://images-na.ssl-images-amazon.com/images/S/amazon-avatars-global/default._CR0,0,1024,1024_SX48_.png""/>","EWA","https://www.amazon.com/gp/customer-reviews/R1FRS1VIXEODRM/ref=cm_cr_arp_d_rvw_ttl?ie=UTF8&ASIN=B00JN9EP6E","5.0 out of 5 stars","SMALL DOGS? YES! Phenomenal!","Reviewed in the United States on July 6, 2023","Flavor Name: Vanilla MintSize: Small (Pack of 1)","https://www.amazon.com/Twistix-5-5-Ounce-Dental-Peanut-Flavor/product-reviews/B00GTV7WA0/ref=cm_cr_arp_d_rvw_fmt?ie=UTF8&formatType=current_format","I've been buying these for yrs now; a 7pk ONLY available at location near me, ONLY carried. $8+for 7pk; PLUS, ONLY option. WHAT?! I buy 2packs, split in half (dachshund & pug); lasts a month, & split in half easy enough to use hands! Buy! Buy! Buy!","One person found this helpful","https://www.amazon.com/ap/signin?openid.return_to=https%3A%2F%2Fwww.amazon.com%2FTwistix-5-5-Ounce-Dental-Peanut-Flavor%2Fproduct-reviews%2FB00JN9EP6E%2Fref%3Dcm_cr_arp_d_vote_lft%3Fie%3DUTF8%26csrfT%3DhOsnSjIxHY%252Fl6NnHIk1FTe0aUq3Qlwmb6qsnaNOZJhT%252BAAAAAGXT40EAAAAB%26reviewId%3DR1FRS1VIXEODRM&openid.identity=http%3A%2F%2Fspecs.openid.net%2Fauth%2F2.0%2Fidentifier_select&openid.assoc_handle=usflex&openid.mode=checkid_setup&marketPlaceId=ATVPDKIKX0DER&language=en&openid.claimed_id=http%3A%2F%2Fspecs.openid.net%2Fauth%2F2.0%2Fidentifier_select&openid.ns=http%3A%2F%2Fspecs.openid.net%2Fauth%2F2.0","Report","https://www.amazon.com/hz/reviews-render/report-review?ie=UTF8&ref=cm_cr_arp_d_rvw_hlp&csrfT=hOsnSjIxHY%2Fl6NnHIk1FTe0aUq3Qlwmb6qsnaNOZJhT%2BAAAAAGXT40EAAAAB&reviewId=R1FRS1VIXEODRM","Showing  comments","https://images-na.ssl-images-amazon.com/images/G/01/x-locale/common/grey-pixel.gif"
"https://www.amazon.com/gp/profile/amzn1.account.AHDY5RKYXR2TA6CLECPHHNDQPD7A/ref=cm_cr_arp_d_gw_btm?ie=UTF8","<img src=""https://images-na.ssl-images-amazon.com/images/S/amazon-avatars-global/default._CR0,0,1024,1024_SX48_.png""/>","Tashanna Hammond","https://www.amazon.com/gp/customer-reviews/R1W8XGU7YN09AU/ref=cm_cr_arp_d_rvw_ttl?ie=UTF8&ASIN=B00JN9EP6E","4.0 out of 5 stars","Wish it came with more","Reviewed in the United States on January 9, 2023","Flavor Name: Vanilla MintSize: Small (Pack of 1)","https://www.amazon.com/Twistix-5-5-Ounce-Dental-Peanut-Flavor/product-reviews/B00GTV7WA0/ref=cm_cr_arp_d_rvw_fmt?ie=UTF8&formatType=current_format","Less content and I thought. Will pay the extra and get minties next time","Report","https://www.amazon.com/ap/signin?openid.return_to=https%3A%2F%2Fwww.amazon.com%2FTwistix-5-5-Ounce-Dental-Peanut-Flavor%2Fproduct-reviews%2FB00JN9EP6E%2Fref%3Dcm_cr_arp_d_vote_lft%3Fie%3DUTF8%26csrfT%3DhK7tLfyKbFZdBeJlA9L2n3uWI0LOb2%252FJJitVkDUm7gULAAAAAGXT40EAAAAB%26reviewId%3DR1W8XGU7YN09AU&openid.identity=http%3A%2F%2Fspecs.openid.net%2Fauth%2F2.0%2Fidentifier_select&openid.assoc_handle=usflex&openid.mode=checkid_setup&marketPlaceId=ATVPDKIKX0DER&language=en&openid.claimed_id=http%3A%2F%2Fspecs.openid.net%2Fauth%2F2.0%2Fidentifier_select&openid.ns=http%3A%2F%2Fspecs.openid.net%2Fauth%2F2.0","Showing  comments","https://www.amazon.com/hz/reviews-render/report-review?ie=UTF8&ref=cm_cr_arp_d_rvw_hlp&csrfT=hK7tLfyKbFZdBeJlA9L2n3uWI0LOb2%2FJJitVkDUm7gULAAAAAGXT40EAAAAB&reviewId=R1W8XGU7YN09AU","","https://images-na.ssl-images-amazon.com/images/G/01/x-locale/common/grey-pixel.gif"
"https://www.amazon.com/gp/profile/amzn1.account.AEKGJK4Y2YIVYOOE2XKNN5NTQVQQ/ref=cm_cr_arp_d_gw_btm?ie=UTF8","<img src=""https://images-na.ssl-images-amazon.com/images/S/amazon-avatars/default._CR0,0,1024,1024_SX48_.png""/>","Kp","https://www.amazon.com/gp/customer-reviews/R19A7YINNOE8I/ref=cm_cr_arp_d_rvw_ttl?ie=UTF8&ASIN=B00JN9EP6E","5.0 out of 5 stars","I was worried about these treats when I first took them out of the bag because they're hard like chalk and my dog is 13 years ol","Reviewed in the United States on February 8, 2016","Flavor Name: Vanilla MintSize: Small (Pack of 1)","https://www.amazon.com/Twistix-5-5-Ounce-Dental-Peanut-Flavor/product-reviews/B00GTV7WA0/ref=cm_cr_arp_d_rvw_fmt?ie=UTF8&formatType=current_format","My Yorkie loves these treats. I was worried about these treats when I first took them out of the bag because they're hard like chalk and my dog is 13 years old. She didn't like them right away but after she started to spend some time on them, they started to dissolve and she could chew on them more easily. These treats are great for distracting dogs but you also have to be careful if they're a smaller dog because the treat is really hard and I could see it could cause choking in over ambitious dogs that don't take the time to break down the treat. The only flaw in these treats is that my dog has a beard and these treats get really milky and foamy and once she finishes her treat it looks like she has rabies and that she's foaming at the mouth. I always find chunks of unfinished twistix dental chews melted to her beard with foam. She loves them so much and they're good for her teeth so I can't complain. I just have to clean her up every time after she's had one of these treats.","10 people found this helpful","https://www.amazon.com/ap/signin?openid.return_to=https%3A%2F%2Fwww.amazon.com%2FTwistix-5-5-Ounce-Dental-Peanut-Flavor%2Fproduct-reviews%2FB00JN9EP6E%2Fref%3Dcm_cr_arp_d_vote_lft%3Fie%3DUTF8%26csrfT%3DhEwpDjznRrTkL47Wg%252BRsT2C1y7M%252BVpKCogYpQOZ23XLlAAAAAGXT40EAAAAB%26reviewId%3DR19A7YINNOE8I&openid.identity=http%3A%2F%2Fspecs.openid.net%2Fauth%2F2.0%2Fidentifier_select&openid.assoc_handle=usflex&openid.mode=checkid_setup&marketPlaceId=ATVPDKIKX0DER&language=en&openid.claimed_id=http%3A%2F%2Fspecs.openid.net%2Fauth%2F2.0%2Fidentifier_select&openid.ns=http%3A%2F%2Fspecs.openid.net%2Fauth%2F2.0","Report","https://www.amazon.com/hz/reviews-render/report-review?ie=UTF8&ref=cm_cr_arp_d_rvw_hlp&csrfT=hEwpDjznRrTkL47Wg%2BRsT2C1y7M%2BVpKCogYpQOZ23XLlAAAAAGXT40EAAAAB&reviewId=R19A7YINNOE8I","Showing  comments","https://images-na.ssl-images-amazon.com/images/G/01/x-locale/common/grey-pixel.gif"
"https://www.amazon.com/gp/profile/amzn1.account.AECZULHNPVAY5QNUKBCVY26Q6DPA/ref=cm_cr_getr_d_gw_btm?ie=UTF8","<img src=""https://images-na.ssl-images-amazon.com/images/S/amazon-avatars-global/a096890c-b411-41dd-8068-f6e9e092e2f6._CR0,0,500,500_SX48_.jpg""/>","DB's Treasures on Mercari","https://www.amazon.com/gp/customer-reviews/R29NZCSL0C5NQD/ref=cm_cr_getr_d_rvw_ttl?ie=UTF8&ASIN=B00JN9EP6E","4.0 out of 5 stars","Dogs liked these dental stick!","Reviewed in the United States on September 27, 2021","Flavor Name: Vanilla MintSize: Small (Pack of 1)","https://www.amazon.com/Twistix-5-5-Ounce-Dental-Peanut-Flavor/product-reviews/B00GTV7WA0/ref=cm_cr_getr_d_rvw_fmt?ie=UTF8&formatType=current_format","My 3 dogs enjoyed these dental sticks, even my picky dog, but I'll probably not buy them again because with having 3 dogs I need bulk... So if they ever offer a bulk of 100+ dental sticks at a decent discounted price per piece then I'm on board!","Report","https://www.amazon.com/ap/signin?openid.return_to=https%3A%2F%2Fwww.amazon.com%2FTwistix-5-5-Ounce-Dental-Peanut-Flavor%2Fproduct-reviews%2FB00JN9EP6E%2Fref%3Dcm_cr_getr_d_vote_lft%3Fie%3DUTF8%26pageSize%3D10%26csrfT%3DhE%252FiWg0TowbTxoAgMIYNtuW8IldjL%252BoW0IbTtImDaiiZAAAAAGXT40sAAAAB%26reviewId%3DR29NZCSL0C5NQD&openid.identity=http%3A%2F%2Fspecs.openid.net%2Fauth%2F2.0%2Fidentifier_select&openid.assoc_handle=usflex&openid.mode=checkid_setup&marketPlaceId=ATVPDKIKX0DER&language=en&openid.claimed_id=http%3A%2F%2Fspecs.openid.net%2Fauth%2F2.0%2Fidentifier_select&openid.ns=http%3A%2F%2Fspecs.openid.net%2Fauth%2F2.0","Showing  comments","https://www.amazon.com/hz/reviews-render/report-review?ie=UTF8&ref=cm_cr_getr_d_rvw_hlp&csrfT=hE%2FiWg0TowbTxoAgMIYNtuW8IldjL%2BoW0IbTtImDaiiZAAAAAGXT40sAAAAB&reviewId=R29NZCSL0C5NQD","",""
"https://www.amazon.com/gp/profile/amzn1.account.AFVB2BACPQKJCZBS55KRYTLNAUYQ/ref=cm_cr_getr_d_gw_btm?ie=UTF8","<img src=""https://images-na.ssl-images-amazon.com/images/S/amazon-avatars-global/default._CR0,0,1024,1024_SX48_.png""/>","Samantha dolan","https://www.amazon.com/gp/customer-reviews/R3FLTGFKZKI62W/ref=cm_cr_getr_d_rvw_ttl?ie=UTF8&ASIN=B00JN9EP6E","4.0 out of 5 stars","Dog breath saver","Reviewed in the United States on April 5, 2021","Flavor Name: Vanilla MintSize: Small (Pack of 1)","https://www.amazon.com/Twistix-5-5-Ounce-Dental-Peanut-Flavor/product-reviews/B00GTV7WA0/ref=cm_cr_getr_d_rvw_fmt?ie=UTF8&formatType=current_format","My 20 pound dog loves these. I give her one early in the day and one later in the day after dinner and they really seem to be helping with her bad breath. They are the first ones we’ve gotten that actually smell minty.","Report","https://www.amazon.com/ap/signin?openid.return_to=https%3A%2F%2Fwww.amazon.com%2FTwistix-5-5-Ounce-Dental-Peanut-Flavor%2Fproduct-reviews%2FB00JN9EP6E%2Fref%3Dcm_cr_getr_d_vote_lft%3Fie%3DUTF8%26pageSize%3D10%26csrfT%3DhFJIww70lWdMIvEFulsQrAezwCji920v4%252BcYlqWeAdXQAAAAAGXT40sAAAAB%26reviewId%3DR3FLTGFKZKI62W&openid.identity=http%3A%2F%2Fspecs.openid.net%2Fauth%2F2.0%2Fidentifier_select&openid.assoc_handle=usflex&openid.mode=checkid_setup&marketPlaceId=ATVPDKIKX0DER&language=en&openid.claimed_id=http%3A%2F%2Fspecs.openid.net%2Fauth%2F2.0%2Fidentifier_select&openid.ns=http%3A%2F%2Fspecs.openid.net%2Fauth%2F2.0","Showing  comments","https://www.amazon.com/hz/reviews-render/report-review?ie=UTF8&ref=cm_cr_getr_d_rvw_hlp&csrfT=hFJIww70lWdMIvEFulsQrAezwCji920v4%2BcYlqWeAdXQAAAAAGXT40sAAAAB&reviewId=R3FLTGFKZKI62W","",""
